{
  "schema_version": "1.0",
  "collector": "promstack",
  "collector_version": "1.0.0",
  "run": {
    "started_at": "2026-06-22T11:22:19Z",
    "finished_at": "2026-06-22T11:22:19Z",
    "target": "http://localhost:8428",
    "lookback": "7d",
    "args_redacted": {}
  },
  "environment": {
    "detected_backend": "victoriametrics",
    "version": "victoria-metrics-20240828-135334-tags-v1.103.0-0-g5aeb759df9",
    "detection_method": "vm_app_version metric present"
  },
  "figures": [
    {
      "id": "metrics.active_series",
      "label": "Active time series",
      "value": 3906.0,
      "unit": "series",
      "status": "ok",
      "method": "VM hour_metric_ids cache entry count",
      "source_api": "GET /api/v1/query",
      "query": "vm_cache_entries{type=\"storage/hour_metric_ids\"}",
      "time_window": null,
      "evidence_files": [
        "evidence/prom_instant_active_series.json"
      ],
      "notes": null,
      "unavailable_reason": null,
      "remediation": null
    },
    {
      "id": "metrics.samples_per_sec",
      "label": "Ingestion rate",
      "value": 396.46,
      "unit": "samples/sec",
      "status": "ok",
      "method": "5m rate of vm_rows_inserted_total",
      "source_api": "GET /api/v1/query",
      "query": "sum(rate(vm_rows_inserted_total[5m]))",
      "time_window": null,
      "evidence_files": [
        "evidence/prom_instant_samples_rate.json"
      ],
      "notes": null,
      "unavailable_reason": null,
      "remediation": null
    },
    {
      "id": "promstack.scrape_targets",
      "label": "Scrape targets",
      "value": 3.0,
      "unit": "targets",
      "status": "ok",
      "method": "count of up metric",
      "source_api": "GET /api/v1/query",
      "query": "count(up)",
      "time_window": null,
      "evidence_files": [
        "evidence/prom_instant_scrape_targets.json"
      ],
      "notes": null,
      "unavailable_reason": null,
      "remediation": null
    },
    {
      "id": "promstack.retention_days",
      "label": "Retention period",
      "value": 90.0,
      "unit": "days",
      "status": "ok",
      "method": "-retentionPeriod=90d",
      "source_api": "GET /flags",
      "query": null,
      "time_window": null,
      "evidence_files": [
        "evidence/status_flags.json"
      ],
      "notes": null,
      "unavailable_reason": null,
      "remediation": null
    },
    {
      "id": "logs.ingest_gb_per_day",
      "label": "Log ingestion rate",
      "value": null,
      "unit": "GB/day",
      "status": "unavailable",
      "method": null,
      "source_api": null,
      "query": null,
      "time_window": null,
      "evidence_files": [],
      "notes": null,
      "unavailable_reason": "not_configured: Loki distributor metrics not found in TSDB",
      "remediation": "Ensure Loki metrics are scraped into your TSDB, or provide --loki-endpoint"
    },
    {
      "id": "logs.retention_days",
      "label": "Log retention",
      "value": null,
      "unit": "days",
      "status": "unavailable",
      "method": null,
      "source_api": null,
      "query": null,
      "time_window": null,
      "evidence_files": [],
      "notes": null,
      "unavailable_reason": "not_configured: Loki /config not available",
      "remediation": "Provide --loki-endpoint to read Loki config"
    },
    {
      "id": "traces.spans_per_sec",
      "label": "Span ingestion rate",
      "value": null,
      "unit": "spans/sec",
      "status": "unavailable",
      "method": null,
      "source_api": null,
      "query": null,
      "time_window": null,
      "evidence_files": [],
      "notes": null,
      "unavailable_reason": "not_configured: Tempo distributor metrics not found in TSDB",
      "remediation": "Ensure Tempo metrics are scraped into your TSDB, or provide --tempo-endpoint"
    },
    {
      "id": "traces.ingest_gb_per_day",
      "label": "Trace ingestion rate",
      "value": null,
      "unit": "GB/day",
      "status": "unavailable",
      "method": null,
      "source_api": null,
      "query": null,
      "time_window": null,
      "evidence_files": [],
      "notes": null,
      "unavailable_reason": "not_configured: Tempo distributor metrics not found in TSDB",
      "remediation": "Ensure Tempo metrics are scraped into your TSDB, or provide --tempo-endpoint"
    }
  ],
  "inventory": {
    "backend": "victoriametrics",
    "top_metrics_by_series": [
      {
        "name": "flag",
        "value": 448
      },
      {
        "name": "vm_http_requests_total",
        "value": 154
      },
      {
        "name": "node_nfs_requests_total",
        "value": 99
      },
      {
        "name": "node_cpu_seconds_total",
        "value": 96
      },
      {
        "name": "vm_http_request_errors_total",
        "value": 92
      },
      {
        "name": "node_nfsd_requests_total",
        "value": 74
      },
      {
        "name": "go_gc_pauses_seconds_bucket",
        "value": 70
      },
      {
        "name": "go_sched_latencies_seconds_bucket",
        "value": 70
      },
      {
        "name": "vminsert_request_duration_seconds_bucket",
        "value": 52
      },
      {
        "name": "prometheus_http_requests_total",
        "value": 51
      }
    ]
  },
  "gaps": [
    {
      "area": "logs",
      "figure_ids": [
        "logs.ingest_gb_per_day"
      ],
      "reason": "not_configured",
      "detail": "Loki distributor metrics not found in TSDB",
      "remediation": "Ensure Loki metrics are scraped into your TSDB, or provide --loki-endpoint"
    },
    {
      "area": "logs",
      "figure_ids": [
        "logs.retention_days"
      ],
      "reason": "not_configured",
      "detail": "Loki /config not available",
      "remediation": "Provide --loki-endpoint to read Loki config"
    },
    {
      "area": "traces",
      "figure_ids": [
        "traces.spans_per_sec"
      ],
      "reason": "not_configured",
      "detail": "Tempo distributor metrics not found in TSDB",
      "remediation": "Ensure Tempo metrics are scraped into your TSDB, or provide --tempo-endpoint"
    },
    {
      "area": "traces",
      "figure_ids": [
        "traces.ingest_gb_per_day"
      ],
      "reason": "not_configured",
      "detail": "Tempo distributor metrics not found in TSDB",
      "remediation": "Ensure Tempo metrics are scraped into your TSDB, or provide --tempo-endpoint"
    }
  ]
}
